{
  "KIND": "FUNCTION_SPEC",
  "TRACE_ID": "coap/resource/resource_router/coap_resource_router_create",
  "FUNCTION_TYPE": "ALGORITHM",
  "ROLE": "分配空 resource router",
  "SIGNATURE": {
    "RAW": "coap_resource_router_t* coap_resource_router_create(void)",
    "NAME": "coap_resource_router_create",
    "RETURN": "coap_resource_router_t*",
    "PARAMS": []
  },
  "RELY": {
    "STRUCT": [
      {
        "NAME": "coap_resource_router_t",
        "ROLE": "资源注册表与 dispatch 逻辑的不透明句柄"
      },
      {
        "NAME": "coap_resource_entry_t",
        "ROLE": "本函数使用的模块内部数据结构"
      }
    ],
    "FUNC": [],
    "VAR": []
  },
  "LOGIC": {
    "INPUT": "无参数输入。",
    "ACTION": "分配空 resource router",
    "OUTPUT": "返回结果、已借用对象或新分配对象的指针；无结果或失败时返回 NULL，所有权由 ROLE/CALL_CONTRACTS 限定。",
    "INVARIANTS_USED": [
      "不得引入超出当前 minimum_v1 代码行为的协议语义"
    ]
  }
}
