{
  "KIND": "FUNCTION_SPEC",
  "TRACE_ID": "mqtt/router/message_router/mqtt_message_router_subscribe",
  "FUNCTION_TYPE": "ALGORITHM",
  "ROLE": "建立会话与主题过滤器的订阅关系",
  "SIGNATURE": {
    "RAW": "void mqtt_message_router_subscribe(mqtt_message_router_t* r, int session_id, const char* filter)",
    "NAME": "mqtt_message_router_subscribe",
    "RETURN": "void",
    "PARAMS": [
      {
        "TYPE": "mqtt_message_router_t*",
        "NAME": "r",
        "NULLABLE": true,
        "OWNERSHIP": "BORROWED"
      },
      {
        "TYPE": "int",
        "NAME": "session_id",
        "NULLABLE": false,
        "OWNERSHIP": "BORROWED"
      },
      {
        "TYPE": "const char*",
        "NAME": "filter",
        "NULLABLE": true,
        "OWNERSHIP": "BORROWED"
      }
    ]
  },
  "RELY": {
    "STRUCT": [
      {
        "NAME": "struct mqtt_message_router",
        "ROLE": "消息路由器私有状态结构体"
      }
    ],
    "FUNC": [
      {
        "NAME": "mqtt_topic_tree_subscribe",
        "KIND": "CALL",
        "ROLE": "登记订阅关系"
      }
    ],
    "VAR": []
  },
  "LOGIC": {
    "INPUT": "输入为路由器 r、会话 ID session_id、过滤器 filter",
    "ACTION": "r 为空直接返回；否则调用 mqtt_topic_tree_subscribe 写入订阅关系",
    "OUTPUT": "无返回值；订阅结果体现在 topic_tree",
    "INVARIANTS_USED": [
      "路由层不复制业务状态，仅委托 topic_tree 存储",
      "非法 r 不产生副作用"
    ]
  }
}
