{
  "KIND": "FUNCTION_SPEC",
  "TRACE_ID": "mqtt/router/message_router/mqtt_message_router_destroy",
  "FUNCTION_TYPE": "ALGORITHM",
  "ROLE": "销毁消息路由器并释放主题树资源",
  "SIGNATURE": {
    "RAW": "void mqtt_message_router_destroy(mqtt_message_router_t* r)",
    "NAME": "mqtt_message_router_destroy",
    "RETURN": "void",
    "PARAMS": [
      {
        "TYPE": "mqtt_message_router_t*",
        "NAME": "r",
        "NULLABLE": true,
        "OWNERSHIP": "BORROWED"
      }
    ]
  },
  "RELY": {
    "STRUCT": [
      {
        "NAME": "struct mqtt_message_router",
        "ROLE": "消息路由器私有状态结构体"
      }
    ],
    "FUNC": [
      {
        "NAME": "mqtt_topic_tree_destroy",
        "KIND": "CALL",
        "ROLE": "销毁主题订阅树"
      }
    ],
    "VAR": []
  },
  "LOGIC": {
    "INPUT": "输入为路由器指针 r（可为空）",
    "ACTION": "r 为空直接返回；否则销毁 r->topics 并释放 r",
    "OUTPUT": "无返回值",
    "INVARIANTS_USED": [
      "不销毁外部传入的 session_manager",
      "可安全处理 NULL 输入"
    ]
  }
}
