{
  "KIND": "FUNCTION_SPEC",
  "TRACE_ID": "mqtt/broker/session/mqtt_session_mark_connected",
  "FUNCTION_TYPE": "EVENT",
  "ROLE": "在 CONNECT 报文通过后更新会话握手状态与协商参数",
  "SIGNATURE": {
    "RAW": "void mqtt_session_mark_connected(mqtt_session_t* s, const char* client_id, bool clean_session, uint16_t keep_alive)",
    "NAME": "mqtt_session_mark_connected",
    "RETURN": "void",
    "PARAMS": [
      {
        "TYPE": "mqtt_session_t*",
        "NAME": "s",
        "NULLABLE": true,
        "OWNERSHIP": "BORROWED"
      },
      {
        "TYPE": "const char*",
        "NAME": "client_id",
        "NULLABLE": true,
        "OWNERSHIP": "BORROWED"
      },
      {
        "TYPE": "bool",
        "NAME": "clean_session",
        "NULLABLE": false,
        "OWNERSHIP": "BORROWED"
      },
      {
        "TYPE": "uint16_t",
        "NAME": "keep_alive",
        "NULLABLE": false,
        "OWNERSHIP": "BORROWED"
      }
    ]
  },
  "RELY": {
    "STRUCT": [
      {
        "NAME": "struct mqtt_session",
        "ROLE": "会话私有实现结构"
      }
    ],
    "FUNC": [],
    "VAR": []
  },
  "EVENT": {
    "TRIGGER": "broker 在处理 CONNECT 报文并准备发送 CONNACK 前触发",
    "PRECONDITION": "s 应为有效会话；client_id 可为空",
    "INPUT": "输入为会话指针、client_id、clean_session 与 keep_alive",
    "ACTION": "设置 connected=true；释放旧 client_id；若新 client_id 非空则复制保存；更新 clean_session 与 keep_alive",
    "STATE_CHANGE": "会话由未连接转为已连接，并刷新身份与会话参数",
    "RESPONSE": "无返回值；后续逻辑可基于 connected/client_id 继续处理订阅与发布",
    "EVENT_TYPE": "RUNTIME_EVENT"
  }
}
