{
  "KIND": "FUNCTION_SPEC",
  "TRACE_ID": "mqtt/topic/topic_tree/next_level",
  "FUNCTION_TYPE": "ALGORITHM",
  "ROLE": "按 / 分隔提取主题层级分段并推进读取位置",
  "SIGNATURE": {
    "RAW": "static bool next_level(const char* s, size_t s_len, size_t* io_pos, const char** out_start, size_t* out_len, bool* out_done)",
    "NAME": "next_level",
    "RETURN": "bool",
    "PARAMS": [
      {
        "TYPE": "const char*",
        "NAME": "s",
        "NULLABLE": false,
        "OWNERSHIP": "BORROWED"
      },
      {
        "TYPE": "size_t",
        "NAME": "s_len",
        "NULLABLE": false,
        "OWNERSHIP": "BORROWED"
      },
      {
        "TYPE": "size_t*",
        "NAME": "io_pos",
        "NULLABLE": false,
        "OWNERSHIP": "BORROWED"
      },
      {
        "TYPE": "const char**",
        "NAME": "out_start",
        "NULLABLE": false,
        "OWNERSHIP": "BORROWED"
      },
      {
        "TYPE": "size_t*",
        "NAME": "out_len",
        "NULLABLE": false,
        "OWNERSHIP": "BORROWED"
      },
      {
        "TYPE": "bool*",
        "NAME": "out_done",
        "NULLABLE": false,
        "OWNERSHIP": "BORROWED"
      }
    ]
  },
  "RELY": {
    "STRUCT": [],
    "FUNC": [],
    "VAR": []
  },
  "LOGIC": {
    "INPUT": "输入为主题字符串 s、长度 s_len、位置指针 io_pos 以及输出片段指针 out_start/out_len/out_done。",
    "ACTION": "按 / 提取下一层片段，输出片段范围并推进游标与结束标记。",
    "OUTPUT": "参数非法返回 false；成功时输出当前层级片段范围，推进 *io_pos，并设置是否到达末尾。",
    "INVARIANTS_USED": [
      "不修改输入字符串",
      "到达末尾时使用 s_len+1 作为哨兵位置"
    ]
  }
}
