{
  "KIND": "FUNCTION_SPEC",
  "TRACE_ID": "coap/protocol/coap_message/coap_bytes_free",
  "FUNCTION_TYPE": "ALGORITHM",
  "ROLE": "释放编码结果 data，并将 data/len 复位",
  "SIGNATURE": {
    "RAW": "void coap_bytes_free(coap_bytes_t* bytes)",
    "NAME": "coap_bytes_free",
    "RETURN": "void",
    "PARAMS": [
      {
        "TYPE": "coap_bytes_t*",
        "NAME": "bytes",
        "NULLABLE": true,
        "OWNERSHIP": "BORROWED"
      }
    ]
  },
  "RELY": {
    "STRUCT": [
      {
        "NAME": "coap_bytes_t",
        "ROLE": "编码结果动态字节缓冲，由 coap_bytes_free 释放"
      }
    ],
    "FUNC": [],
    "VAR": []
  },
  "LOGIC": {
    "INPUT": "bytes 是可能为空的 encoded bytes 对象。",
    "ACTION": "若 bytes 为空直接返回。否则 free(bytes->data)，再将 data 置 NULL、len 置 0。",
    "OUTPUT": "无返回值；非空 bytes 被复位为空缓冲状态。",
    "INVARIANTS_USED": [
      "只释放 data，不释放 coap_bytes_t 对象本身。"
    ]
  }
}
