{
  "KIND": "FUNCTION_SPEC",
  "TRACE_ID": "coap/protocol/coap_message/coap_message_init",
  "FUNCTION_TYPE": "ALGORITHM",
  "ROLE": "将 message 清零并设置 version=1；空指针安全返回",
  "SIGNATURE": {
    "RAW": "void coap_message_init(coap_message_t* msg)",
    "NAME": "coap_message_init",
    "RETURN": "void",
    "PARAMS": [
      {
        "TYPE": "coap_message_t*",
        "NAME": "msg",
        "NULLABLE": true,
        "OWNERSHIP": "BORROWED"
      }
    ]
  },
  "RELY": {
    "STRUCT": [
      {
        "NAME": "coap_message_t",
        "ROLE": "统一 CoAP message 对象，保存 header、token、options 与 payload"
      }
    ],
    "FUNC": [],
    "VAR": []
  },
  "LOGIC": {
    "INPUT": "msg 是可能为空的 message 对象指针。",
    "ACTION": "若 msg 为空直接返回。否则 memset 整个对象为 0，并将 version 设置为 1。",
    "OUTPUT": "无返回值；非空 msg 变为 version=1 的空 message，所有 pointer/count/length 字段为 0。",
    "INVARIANTS_USED": [
      "初始化不会释放 msg 之前可能持有的动态内存；调用者必须先 reset/free 旧内容。"
    ]
  }
}
