{
  "KIND": "FUNCTION_SPEC",
  "TRACE_ID": "smtp/server_app/smtp_server/remove_session",
  "FUNCTION_TYPE": "ALGORITHM",
  "ROLE": "按 fd 移除并销毁 session 链表节点",
  "SIGNATURE": {
    "RAW": "static void remove_session(smtp_server_t* server, int fd)",
    "NAME": "remove_session",
    "RETURN": "void",
    "PARAMS": [
      {
        "TYPE": "smtp_server_t*",
        "NAME": "server",
        "NULLABLE": true,
        "OWNERSHIP": "BORROWED"
      },
      {
        "TYPE": "int",
        "NAME": "fd",
        "NULLABLE": false,
        "OWNERSHIP": "BORROWED"
      }
    ]
  },
  "RELY": {
    "STRUCT": [
      {
        "NAME": "smtp_server_t",
        "ROLE": "该函数读取或维护的结构化状态"
      },
      {
        "NAME": "smtp_session_node_t",
        "ROLE": "该函数读取或维护的结构化状态"
      }
    ],
    "FUNC": [
      {
        "NAME": "smtp_session_destroy",
        "KIND": "CALL",
        "ROLE": "被该函数调用以完成子步骤"
      }
    ],
    "VAR": []
  },
  "LOGIC": {
    "INPUT": "输入参数：server(smtp_server_t*，可为 NULL，BORROWED)；fd(int，不可为 NULL，BORROWED)。",
    "ACTION": "按 fd 移除并销毁 session 链表节点。",
    "OUTPUT": "无返回值；副作用为按 fd 移除并销毁 session 链表节点。",
    "INVARIANTS_USED": [
      "仅面向单线程事件循环或单线程调用路径；跨线程访问必须由上层同步。",
      "函数可能分配资源、消费缓冲、修改链表、写文件或更新网络状态，不承诺幂等。",
      "调用方必须遵守 SIGNATURE.PARAMS 中的 NULLABLE 与 OWNERSHIP 约束。",
      "维护 server->sessions：删除匹配节点"
    ]
  },
  "ACCESS_PATHS": [
    {
      "PATH": "server->sessions",
      "TYPE": "smtp_session_node_t*",
      "ROLE": "删除匹配节点"
    }
  ]
}
