{
  "KIND": "FUNCTION_SPEC",
  "TRACE_ID": "src/wire.c/wire_encode_connack",
  "FUNCTION_TYPE": "ALGORITHM",
  "ROLE": "Append a complete CONNACK packet (0x20, Remaining Length 2, acknowledge flags, return code) to a caller-owned output buffer.",
  "SIGNATURE": {
    "RAW": "int wire_encode_connack(struct byte_buf *out, uint8_t ack_flags, uint8_t return_code)",
    "NAME": "wire_encode_connack",
    "RETURN": "int",
    "PARAMS": [
      {"TYPE": "struct byte_buf *", "NAME": "out", "NULLABLE": true, "OWNERSHIP": "BORROWED"},
      {"TYPE": "uint8_t", "NAME": "ack_flags", "NULLABLE": false, "OWNERSHIP": "BORROWED"},
      {"TYPE": "uint8_t", "NAME": "return_code", "NULLABLE": false, "OWNERSHIP": "BORROWED"}
    ]
  },
  "RELY": {
    "STRUCT": [{"NAME": "struct byte_buf", "ROLE": "destination for the encoded packet bytes"}],
    "FUNC": [
      {"NAME": "buffer_reserve", "KIND": "CALL", "ROLE": "allocate the whole 4-byte packet before the first byte is written"},
      {"NAME": "buffer_append", "KIND": "CALL", "ROLE": "append the fixed header byte and the two variable header bytes"}
    ],
    "VAR": [
      {"NAME": "WIRE_PACKET_CONNACK", "ROLE": "control packet type 2 (fixed header nibble 0x20)"},
      {"NAME": "WIRE_MAX_STRING_LENGTH", "ROLE": "unused upper bound constant available to the module"}
    ]
  },
  "CALL_CONTRACTS": [
    {
      "NAME": "buffer_reserve",
      "SIGNATURE": "int buffer_reserve(struct byte_buf *buf, size_t extra)",
      "PARAMS": [
        {"NAME": "buf", "TYPE": "struct byte_buf *", "OWNERSHIP": "BORROWED"},
        {"NAME": "extra", "TYPE": "size_t", "OWNERSHIP": "BORROWED"}
      ],
      "RETURN": "0 when cap >= len + extra; -1 on overflow or allocation failure",
      "OWNERSHIP": "the buffer keeps or grows its own storage; no transfer",
      "FAILURE": "-1 means nothing was written and the contents are unchanged, so the caller returns -2"
    },
    {
      "NAME": "buffer_append",
      "SIGNATURE": "int buffer_append(struct byte_buf *buf, const void *src, size_t len)",
      "PARAMS": [
        {"NAME": "buf", "TYPE": "struct byte_buf *", "OWNERSHIP": "BORROWED"},
        {"NAME": "src", "TYPE": "const void *", "OWNERSHIP": "BORROWED"},
        {"NAME": "len", "TYPE": "size_t", "OWNERSHIP": "BORROWED"}
      ],
      "RETURN": "0 when all len bytes were appended; -1 when nothing was appended",
      "OWNERSHIP": "no ownership transfer; the byte values are copied",
      "FAILURE": "cannot fail once buffer_reserve has covered the full packet; a -1 is propagated as -2"
    }
  ],
  "LOGIC": {
    "INPUT": "out: caller-owned buffer receiving exactly 4 bytes. ack_flags: CONNACK acknowledge flags byte. return_code: CONNACK return code.",
    "ACTION": "1) If out is NULL return -1. 2) Validate arguments before writing any byte: if (ack_flags & 0xFE) != 0 return -1 (only bit 0, Session Present, is defined; the other bits are reserved and must be 0); if return_code > 5 return -1 (only 0x00..0x05 are defined MQTT 3.1.1 return codes). 3) If buffer_reserve(out, 4) != 0 return -2 (allocation failure; the buffer contents are unchanged, the caller closes the session and nothing is sent). 4) byte0 = (WIRE_PACKET_CONNACK << 4) | 0x00 = 0x20; byte1 = 0x02 (Remaining Length 2); buffer_append(out, &byte0, 1); buffer_append(out, &byte1, 1); buffer_append(out, &ack_flags, 1); buffer_append(out, &return_code, 1). Because the reserve covered all 4 bytes these appends are guaranteed to succeed; if one still returns -1 the function returns -2 and the caller must discard the whole output buffer rather than put it on the wire. 5) Return 0. The packet is appended after any bytes already queued, so a CONNACK can follow queued output without disturbing it.",
    "OUTPUT": "0 when exactly 4 bytes 0x20 0x02 ack_flags return_code were appended and out->len grew by 4; -1 for a NULL out, a reserved ack_flags bit or an undefined return code (no byte written); -2 when the buffer could not be grown (no complete packet appended). The successful CONNACK for scope R02 is wire_encode_connack(out, 0x00, 0x00) -> 20 02 00 00.",
    "INVARIANTS_USED": [
      "CONNACK is 0x20 with Remaining Length 2",
      "the acknowledge flags byte has only bit 0 defined",
      "return codes are 0x00..0x05",
      "a queue append never reorders or drops already queued bytes"
    ],
    "PRECONDITION": "out is NULL or a valid byte_buf owned by the caller.",
    "POSTCONDITION": "on success the last 4 bytes of out are the encoded CONNACK; on -1 nothing changed; on -2 the contents may be unchanged or unusable, and the caller reaches a -2 only by abandoning the buffer.",
    "IDEMPOTENT": false,
    "THREAD_SAFETY": "Not thread safe; the caller owns out exclusively."
  },
  "WIRE_MAPPING": [
    {
      "PACKET": "CONNACK",
      "WIRE_FIELD": "fixed header byte",
      "STRATEGY": "store_in_field",
      "TARGET": "out byte 0",
      "RULE": "0x20: type 2 in the high nibble, reserved flag bits 0 in the low nibble."
    },
    {
      "PACKET": "CONNACK",
      "WIRE_FIELD": "Remaining Length",
      "STRATEGY": "store_in_field",
      "TARGET": "out byte 1",
      "RULE": "0x02: acknowledge flags plus return code, encoded as the single byte 0x02."
    },
    {
      "PACKET": "CONNACK",
      "WIRE_FIELD": "Connect Acknowledge Flags",
      "STRATEGY": "store_in_field",
      "TARGET": "out byte 2",
      "RULE": "ack_flags verbatim; bit 0 is Session Present and must be 0 for a pure clean-session broker, so this broker passes 0x00."
    },
    {
      "PACKET": "CONNACK",
      "WIRE_FIELD": "Connect Return Code",
      "STRATEGY": "store_in_field",
      "TARGET": "out byte 3",
      "RULE": "return_code verbatim (0x00 accepted; 0x01 unacceptable protocol level; 0x02 identifier rejected; codes 3-5 exist but this broker does not use them, and 6-255 are reserved). Fact F023 return codes."
    }
  ],
  "TEST_VECTORS": [
    {
      "NAME": "accepted_connack_bytes",
      "INPUT": {"ack_flags": 0, "return_code": 0},
      "EXPECT": {
        "return": 0,
        "bytes": "20 02 00 00",
        "len_delta": 4,
        "derivation": "fixed header 0x20 (type 2 << 4, flags 0) | Remaining Length 0x02 | ack_flags 0x00 | return code 0x00"
      },
      "LEVEL": "FUNCTION",
      "TRACE_REFS": ["src/wire.c/wire_encode_connack", "src/broker.c/handle_connect"]
    },
    {
      "NAME": "session_present_zero_for_clean_session_broker",
      "INPUT": {"ack_flags": 0, "return_code": 0, "note": "scope R02 accepts only Clean Session = 1, so Session Present is always 0"},
      "EXPECT": {"return": 0, "bytes": "20 02 00 00", "byte_2": "0x00"},
      "LEVEL": "FUNCTION",
      "TRACE_REFS": ["src/wire.c/wire_encode_connack"]
    },
    {
      "NAME": "identifier_rejected_connack_bytes",
      "INPUT": {"ack_flags": 0, "return_code": 2},
      "EXPECT": {"return": 0, "bytes": "20 02 00 02", "derivation": "return code 0x02 = identifier rejected, used for an empty or non-ASCII client id"},
      "LEVEL": "FUNCTION",
      "TRACE_REFS": ["src/wire.c/wire_encode_connack", "src/broker.c/handle_connect"]
    },
    {
      "NAME": "invalid_arguments_are_refused_without_writing",
      "INPUT": {"cases": [
        {"out": null, "ack_flags": 0, "return_code": 0, "note": "NULL destination"},
        {"ack_flags": 2, "return_code": 0, "note": "reserved acknowledge flag bit 1"},
        {"ack_flags": 0, "return_code": 6, "note": "undefined return code"}
      ]},
      "EXPECT": {"returns": [-1, -1, -1], "len_delta": [0, 0, 0]},
      "LEVEL": "FUNCTION",
      "TRACE_REFS": ["src/wire.c/wire_encode_connack"]
    },
    {
      "NAME": "allocation_failure_reports_minus_two",
      "INPUT": {"calls": ["byte_buf out; buffer_init(&out); force buffer_reserve to fail", "wire_encode_connack(&out, 0, 0)"]},
      "EXPECT": {"return": -2, "out_len": 0, "note": "no partial CONNACK is queued"},
      "LEVEL": "FUNCTION",
      "TRACE_REFS": ["src/wire.c/wire_encode_connack", "src/buffer.c/buffer_reserve"]
    }
  ]
}
